{
  "schemaVersion": 1,
  "source": {
    "kind": "openapi",
    "openApiUrl": null,
    "openApiVersion": "3.0.0",
    "title": "🏋️ Grippo API",
    "specHash": "sha256:1c848ebd631db130b0b8c6d28d0c70b5498d57d68cc345f9169e9756cb85a54a",
    "fetchedAt": "2026-08-20T22:07:21.477Z",
    "postmanImportedAt": null
  },
  "stats": {
    "endpoints": 42,
    "areas": 10,
    "schemas": 44
  },
  "areas": {
    "admin": [
      "AdminController_createExerciseExample",
      "AdminController_updateExerciseExample",
      "AdminController_deleteExerciseExample",
      "AdminController_makeAdmin",
      "AdminController_getUsers",
      "AdminController_setUserRole",
      "AdminController_getUserGoal",
      "AdminController_getUserTrainings",
      "AdminController_getUserWeightHistory",
      "AdminController_deleteUser"
    ],
    "auth": [
      "AuthController_login",
      "AuthController_register",
      "AuthController_google",
      "AuthController_apple",
      "AuthController_refresh"
    ],
    "equipments": [
      "EquipmentsController_getEquipments"
    ],
    "exercise-examples": [
      "ExerciseExampleController_getExerciseExamples",
      "ExerciseExampleController_getExerciseExampleById"
    ],
    "exercise-metrics": [
      "ExerciseMetricsController_getAchievements",
      "ExerciseMetricsController_getRecentExercises"
    ],
    "muscles": [
      "MusclesController_getMuscles"
    ],
    "push-tokens": [
      "PushTokensController_savePushToken",
      "PushTokensController_deletePushTokens"
    ],
    "trainings": [
      "TrainingsController_getTrainings",
      "TrainingsController_createTraining",
      "TrainingsController_updateTraining",
      "TrainingsController_getTrainingById",
      "TrainingsController_deleteTraining"
    ],
    "users": [
      "UsersController_getUser",
      "UsersController_createProfile",
      "UsersController_deleteAccount",
      "UsersController_updateExperience",
      "UsersController_updateHeight",
      "UsersController_getExcludedMuscles",
      "UsersController_updateExcludedMuscles",
      "UsersController_getExcludedEquipments",
      "UsersController_updateExcludedEquipments",
      "UsersController_getGoal",
      "UsersController_setGoal"
    ],
    "weight-history": [
      "WeightHistoryController_getWeightHistory",
      "WeightHistoryController_setWeightHistory",
      "WeightHistoryController_removeWeightHistory"
    ]
  },
  "endpoints": [
    {
      "operationId": "AuthController_login",
      "method": "POST",
      "path": "/auth/login",
      "area": "auth",
      "summary": "Login by email and password",
      "auth": "none",
      "deprecated": false,
      "request": {
        "pathParams": [],
        "query": [],
        "body": {
          "schemaRef": "LoginRequest",
          "contentType": "application/json"
        }
      },
      "response": {
        "200": {
          "schemaRef": "LoginResponse",
          "array": false
        }
      },
      "errors": [
        "401"
      ],
      "examples": {
        "request": true,
        "response": true
      }
    },
    {
      "operationId": "AuthController_register",
      "method": "POST",
      "path": "/auth/register",
      "area": "auth",
      "summary": "Register a new user",
      "auth": "none",
      "deprecated": false,
      "request": {
        "pathParams": [],
        "query": [],
        "body": {
          "schemaRef": "RegisterRequest",
          "contentType": "application/json"
        }
      },
      "response": {
        "201": {
          "schemaRef": "LoginResponse",
          "array": false
        }
      },
      "errors": [
        "400"
      ],
      "examples": {
        "request": true,
        "response": true
      }
    },
    {
      "operationId": "AuthController_google",
      "method": "POST",
      "path": "/auth/google",
      "area": "auth",
      "summary": "Login/Register with Google ID token",
      "auth": "none",
      "deprecated": false,
      "request": {
        "pathParams": [],
        "query": [],
        "body": {
          "schemaRef": "GoogleLoginRequest",
          "contentType": "application/json"
        }
      },
      "response": {
        "200": {
          "schemaRef": "LoginResponse",
          "array": false
        }
      },
      "errors": [
        "401"
      ],
      "examples": {
        "request": true,
        "response": true
      }
    },
    {
      "operationId": "AuthController_apple",
      "method": "POST",
      "path": "/auth/apple",
      "area": "auth",
      "summary": "Login/Register with Apple authorization code",
      "auth": "none",
      "deprecated": false,
      "request": {
        "pathParams": [],
        "query": [],
        "body": {
          "schemaRef": "AppleLoginRequest",
          "contentType": "application/json"
        }
      },
      "response": {
        "200": {
          "schemaRef": "LoginResponse",
          "array": false
        }
      },
      "errors": [
        "401"
      ],
      "examples": {
        "request": true,
        "response": true
      }
    },
    {
      "operationId": "AuthController_refresh",
      "method": "POST",
      "path": "/auth/refresh",
      "area": "auth",
      "summary": "Refresh access token",
      "auth": "none",
      "deprecated": false,
      "request": {
        "pathParams": [],
        "query": [],
        "body": {
          "schemaRef": "AuthControllerRefreshBody",
          "contentType": "application/json"
        }
      },
      "response": {
        "200": {
          "schemaRef": "LoginResponse",
          "array": false
        }
      },
      "errors": [
        "401"
      ],
      "examples": {
        "request": false,
        "response": true
      }
    },
    {
      "operationId": "UsersController_getUser",
      "method": "GET",
      "path": "/users",
      "area": "users",
      "summary": "Get current user profile by token",
      "auth": "bearer",
      "deprecated": false,
      "request": {
        "pathParams": [],
        "query": [],
        "body": null
      },
      "response": {
        "200": {
          "schemaRef": "UserResponse",
          "array": false
        }
      },
      "errors": [
        "401"
      ],
      "examples": {
        "request": false,
        "response": true
      }
    },
    {
      "operationId": "UsersController_createProfile",
      "method": "POST",
      "path": "/users",
      "area": "users",
      "summary": "Create user profile after registration",
      "auth": "bearer",
      "deprecated": false,
      "request": {
        "pathParams": [],
        "query": [],
        "body": {
          "schemaRef": "CreateUserProfileRequest",
          "contentType": "application/json"
        }
      },
      "response": {
        "201": {
          "schemaRef": "UserResponse",
          "array": false
        }
      },
      "errors": [
        "400",
        "401"
      ],
      "examples": {
        "request": true,
        "response": true
      }
    },
    {
      "operationId": "UsersController_deleteAccount",
      "method": "DELETE",
      "path": "/users",
      "area": "users",
      "summary": "Delete current user account",
      "auth": "bearer",
      "deprecated": false,
      "request": {
        "pathParams": [],
        "query": [],
        "body": null
      },
      "response": {
        "204": {
          "schemaRef": null,
          "array": false
        }
      },
      "errors": [
        "401"
      ],
      "examples": {
        "request": false,
        "response": false
      }
    },
    {
      "operationId": "UsersController_updateExperience",
      "method": "POST",
      "path": "/users/experience",
      "area": "users",
      "summary": "Update user experience level",
      "auth": "bearer",
      "deprecated": false,
      "request": {
        "pathParams": [],
        "query": [],
        "body": {
          "schemaRef": "UpdateExperienceRequest",
          "contentType": "application/json"
        }
      },
      "response": {
        "200": {
          "schemaRef": "UserResponse",
          "array": false
        }
      },
      "errors": [
        "400"
      ],
      "examples": {
        "request": true,
        "response": true
      }
    },
    {
      "operationId": "UsersController_updateHeight",
      "method": "POST",
      "path": "/users/height",
      "area": "users",
      "summary": "Update user height",
      "auth": "bearer",
      "deprecated": false,
      "request": {
        "pathParams": [],
        "query": [],
        "body": {
          "schemaRef": "UpdateHeightRequest",
          "contentType": "application/json"
        }
      },
      "response": {
        "200": {
          "schemaRef": "UserResponse",
          "array": false
        }
      },
      "errors": [
        "400"
      ],
      "examples": {
        "request": true,
        "response": true
      }
    },
    {
      "operationId": "UsersController_getExcludedMuscles",
      "method": "GET",
      "path": "/users/excluded-muscles",
      "area": "users",
      "summary": "Get all excluded muscles for current user",
      "auth": "bearer",
      "deprecated": false,
      "request": {
        "pathParams": [],
        "query": [],
        "body": null
      },
      "response": {
        "200": {
          "schemaRef": null,
          "array": false
        }
      },
      "errors": [],
      "examples": {
        "request": false,
        "response": false
      }
    },
    {
      "operationId": "UsersController_updateExcludedMuscles",
      "method": "POST",
      "path": "/users/excluded-muscles",
      "area": "users",
      "summary": "Replace excluded muscles with provided list",
      "auth": "bearer",
      "deprecated": false,
      "request": {
        "pathParams": [],
        "query": [],
        "body": {
          "schemaRef": "UpdateExcludedIdsDto",